{
  "$schema": "https://json-schema.org/draft/2020-12/schema",
  "$id": "BAUMAN_ROADMAP_V2_SCHEDULER_CONTRACT_V1",
  "type": "object",
  "additionalProperties": false,
  "required": [
    "schema",
    "version",
    "purpose",
    "mode",
    "upstreamSchemas",
    "phasePolicies",
    "priorityAdmission",
    "sourcePolicy",
    "bundlePolicy",
    "ordering",
    "outputPolicy",
    "capabilities",
    "abortConditions",
    "acceptance"
  ],
  "properties": {
    "schema": { "const": "BAUMAN_ROADMAP_V2_SCHEDULER_CONTRACT_V1" },
    "version": { "type": "string", "minLength": 1 },
    "purpose": { "type": "string", "minLength": 1 },
    "mode": { "type": "object" },
    "upstreamSchemas": { "type": "object" },
    "phasePolicies": {
      "type": "object",
      "required": ["GD0", "GD1", "GD2", "GD3"],
      "additionalProperties": false,
      "properties": {
        "GD0": { "type": "object" },
        "GD1": { "type": "object" },
        "GD2": { "type": "object" },
        "GD3": { "type": "object" }
      }
    },
    "priorityAdmission": { "type": "object" },
    "sourcePolicy": { "type": "object" },
    "bundlePolicy": { "type": "object" },
    "ordering": { "type": "array", "minItems": 1, "items": { "type": "string" } },
    "outputPolicy": { "type": "object" },
    "capabilities": { "type": "object" },
    "abortConditions": { "type": "array", "minItems": 1, "items": { "type": "string" } },
    "acceptance": { "type": "object" }
  }
}
