{
  "schema": "BAUMAN_ROADMAP_V2_SCHEDULER_CONTRACT_V1",
  "version": "2.6.1-l26-b101-current",
  "purpose": "Deterministic weekly schedule projection contract for the current Consumer Blueprint + Priority V2 baseline, without calendar, persistence or runtime writes",
  "mode": {
    "access": "in_memory_projection_harness",
    "productionIntegration": "disconnected",
    "failClosed": true,
    "calendarReadEnabled": false,
    "calendarWriteEnabled": false,
    "persistentStoreEnabled": false,
    "runtimeWriteAllowed": false,
    "dynamicContentGenerationAllowed": false
  },
  "upstreamSchemas": {
    "consumerBlueprint": "BAUMAN_ROADMAP_V2_CONSUMER_BLUEPRINT_V1",
    "priorityContract": "BAUMAN_ROADMAP_V2_PRIORITY_CONTRACT_V2",
    "priorityCandidate": "BAUMAN_ROADMAP_V2_PRIORITY_CANDIDATE_V1",
    "priorityResult": "BAUMAN_ROADMAP_V2_PRIORITY_RESULT_V2"
  },
  "phasePolicies": {
    "GD0": {
      "mode": "russian_parallel_foundation",
      "masterMode": false,
      "currentBaumanOverride": false,
      "russianTwinRequiredForTechnical": false
    },
    "GD1": {
      "mode": "russian_dominant",
      "masterMode": false,
      "currentBaumanOverride": false,
      "technicalSessionMinimumAdvisory": 2,
      "technicalSessionMaximum": 3,
      "technicalRotationTracks": [
        "python",
        "database",
        "math"
      ],
      "russianTwinRequiredForTechnical": true
    },
    "GD2": {
      "mode": "prerequisite_acceleration",
      "masterMode": false,
      "currentBaumanOverride": false,
      "russianTwinRequiredForTechnical": true
    },
    "GD3": {
      "mode": "preview_2_4_weeks_and_nir",
      "masterMode": true,
      "currentBaumanOverride": true,
      "previewWindowWeeks": {
        "minimum": 2,
        "maximum": 4
      },
      "unrelatedStaticPolicy": "defer",
      "russianTwinRequiredForTechnical": true
    }
  },
  "priorityAdmission": {
    "recomputeFromPriorityCandidate": true,
    "acceptCallerSuppliedPriorityResult": false,
    "criticalFirst": true,
    "reviewOnDemandRequiresExplicitRequest": true,
    "reviewOnDemandGrantsMasterReady": false,
    "duplicateItemOrTargetPolicy": "reject"
  },
  "sourcePolicy": {
    "verifiedSourceRequired": true,
    "currentBaumanSourceKind": "current_bauman_official",
    "nirSourceKind": "nir_plan_verified",
    "unverifiedDynamicInputPolicy": "reject",
    "generatesSyllabusOrLessonContent": false
  },
  "bundlePolicy": {
    "technicalAndRussianTwinAtomic": true,
    "callerSuppliesRussianTwinMinutes": true,
    "partialBundleAllowed": false,
    "capacityOverrunAllowed": false
  },
  "ordering": [
    "Critical gap first",
    "GD3 verified Current Bauman item before weighted Priority",
    "Priority rank ascending",
    "due date ascending with null last",
    "target ID ascending",
    "schedule item ID ascending"
  ],
  "outputPolicy": {
    "weeklyProjectionOnly": true,
    "actualCalendarEvents": false,
    "persistentSchedule": false,
    "deepFrozen": true,
    "explainableSelectionAndDeferral": true
  },
  "capabilities": {
    "requestValidate": true,
    "priorityRecompute": true,
    "weeklyProject": true,
    "masterModeOverrideProject": true,
    "russianTwinPlaceholderProject": true,
    "calendarRead": false,
    "calendarWrite": false,
    "persistentStoreWrite": false,
    "runtimeActivation": false,
    "dynamicContentGenerate": false
  },
  "abortConditions": [
    "current Consumer Blueprint or Priority V2 schema mismatch",
    "dependency on quarantined historical Consumer/Priority manifest or baseline hash",
    "unknown phase, target, knowledge state or activity kind",
    "caller-supplied Priority result or derived Priority override",
    "duplicate schedule item, Priority candidate or target ID",
    "unverified source provenance",
    "GD3 Current Bauman item without official source reference",
    "GD3 preview item outside the 2-4 week window",
    "GD3 unrelated static syllabus selected",
    "review-on-demand selected without explicit request",
    "technical item missing its required Russian twin budget",
    "GD1 technical session maximum exceeded",
    "capacity overrun or partial atomic bundle",
    "calendar, persistence, dynamic content or runtime write attempted"
  ],
  "acceptance": {
    "step": 101,
    "currentTrack": "L26",
    "phasePoliciesPinned": true,
    "masterModePreviewWindowPinned": true,
    "consumerBlueprintBoundaryRevalidated": true,
    "priorityV2BoundaryRevalidated": true,
    "staleManifestDependencyRemoved": true,
    "priorityResultsRecomputed": true,
    "productionCalendarConnected": false,
    "runtimeActivationAllowed": false,
    "result": "PASS_CONTRACT_ONLY_PENDING_B101_GATE"
  }
}
